q,desc,subscale,reverse
1,I often set a goal but later choose to pursue a different one.,consistentInterest,1
2,New ideas and projects sometimes distract me from previous ones.,consistentInterest,1
3,I have been obsessed with a certain idea or project for a short time but later lost interest.,consistentInterest,1
4,I have difficulty maintaining my focus on projects that take more than a few months to complete.,consistentInterest,1
5,I finish whatever I begin.,persevereEffort,0
6,Setbacks don't discourage me.,persevereEffort,0
7,I am diligent.,persevereEffort,0
8,I am a hard worker.,persevereEffort,0